{
  "aidp_version": "0.1",
  "id": "example:sample-1",
  "type": "example",
  "checksum": "sha256:c5e9971fd0fc46cc6d4e3b43dd4bac0bf2126492c05e6f71f515781afb49f928",
  "updated_at": "2026-07-20T08:00:00Z",
  "canonical_url": "https://example.aidp.dev/e/sample-1",
  "locale": "en",
  "data": {
    "title": "Sample Entity One",
    "description": "A generic AIDP example entity used for schema conformance testing.",
    "tags": ["sample", "aidp"]
  }
}
